### ISSUE TITLE
gost seems to connect to a different host from the one the file resides when installing packages with yum from different repos

### ISSUE THREAD

**Issue by kpapadimakis** [go-gost/gost#589]
We noticed a strange behavior when using gost as a simple local proxy in Almalinux 9.

Running gost from the command line:

`gost -L :3128`

setting the proxy variables for the proxy

`export http_proxy=http://localhost:3128`

and then trying to install some packages from a bunch of different repositories with yum, we see that gost connects to a different repository host, while trying to fetch some files from another repo. This is repeatable in more than one of our test hosts

```
[root@gargleblaster ~]# yum install cassandra.noarch certbot.noarch ModemManager-glib.x86_64 google-cloud-cli.x86_64 389-ds-base-devel.x86_64 gstreamer1-plugin-openh264.x86_64 almalinux-backgrounds-extras.noarch bgw_replstatus_17.x86_64

Last metadata expiration check: 0:02:44 ago on Fri Oct  4 14:10:43 2024.
..
<lots of output here>
..
[MIRROR] gstreamer1-plugin-openh264-1.18.2-1.el9.x86_64.rpm: Status code: 404 for http://ciscobinary.openh264.org/gstreamer1-plugin-openh264-1.18.2-1.el9.x86_64.rpm
..
<more output>
```

while the gost command output shows that gost seems to try and fetch a file from another host (mirror.ath1.fusioned.net, while the file is in ciscobinary.openh264.org in this case):

```
<lots of output>
{"caller":"chain/router.go:89","handler":"auto","kind":"handler","level":"debug","listener":"tcp","msg":"dial apache.jfrog.io:443/tcp","service":"service-0","sid":"crvssnajcq3qlt2g7re0","time":"2024-10-04T14:15:41.136+03:00"}
{"caller":"chain/router.go:119","handler":"auto","kind":"handler","level":"debug","listener":"tcp","msg":"route(retry=0) apache.jfrog.io:443","service":"service-0","sid":"crvssnajcq3qlt2g7re0","time":"2024-10-04T14:15:41.136+03:00"}
{"caller":"http/handler.go:370","dst":"apache.jfrog.io:443","handler":"http","kind":"handler","level":"info","listener":"tcp","local":"[::1]:3128","msg":"[::1]:44210 <-> apache.jfrog.io:443","remote":"[::1]:44210","service":"service-0","sid":"crvssnajcq3qlt2g7re0","time":"2024-10-04T14:15:41.396+03:00"}
{"caller":"http/handler.go:414","dst":"mirror.ath1.fusioned.net:80","handler":"http","kind":"handler","level":"info","listener":"tcp","local":"[::1]:3128","msg":"[::1]:44146 <-> ciscobinary.openh264.org","remote":"[::1]:44146","service":"service-0","sid":"crvssmijcq3qlt2g7ra0","time":"2024-10-04T14:15:41.429+03:00"}
{"caller":"http/handler.go:426","dst":"mirror.ath1.fusioned.net:80","duration":15319440,"handler":"http","kind":"handler","level":"info","listener":"tcp","local":"[::1]:3128","msg":"[::1]:44146 >-< ciscobinary.openh264.org","remote":"[::1]:44146","service":"service-0","sid":"crvssmijcq3qlt2g7ra0","time":"2024-10-04T14:15:41.444+03:00"}
{"caller":"http/handler.go:414","dst":"mirror.ath1.fusioned.net:80","handler":"http","kind":"handler","level":"info","listener":"tcp","local":"[::1]:3128","msg":"[::1]:44146 <-> ciscobinary.openh264.org","remote":"[::1]:44146","service":"service-0","sid":"crvssmijcq3qlt2g7ra0","time":"2024-10-04T14:15:41.574+03:00"}
{"caller":"http/handler.go:426","dst":"mirror.ath1.fusioned.net:80","duration":14580190,"handler":"http","kind":"handler","level":"info","listener":"tcp","local":"[::1]:3128","msg":"[::1]:44146 >-< ciscobinary.openh264.org","remote":"[::1]:44146","service":"service-0","sid":"crvssmijcq3qlt2g7ra0","time":"2024-10-04T14:15:41.588+03:00"}
{"caller":"http/handler.go:414","dst":"mirror.ath1.fusioned.net:80","handler":"http","kind":"handler","level":"info","listener":"tcp","local":"[::1]:3128","msg":"[::1]:44146 <-> ciscobinary.openh264.org","remote":"[::1]:44146","service":"service-0","sid":"crvssmijcq3qlt2g7ra0","time":"2024-10-04T14:15:41.717+03:00"}
{"caller":"http/handler.go:426","dst":"mirror.ath1.fusioned.net:80","duration":14604955,"handler":"http","kind":"handler","level":"info","listener":"tcp","local":"[::1]:3128","msg":"[::1]:44146 >-< ciscobinary.openh264.org","remote":"[::1]:44146","service":"service-0","sid":"crvssmijcq3qlt2g7ra0","time":"2024-10-04T14:15:41.731+03:00"}
```

We discovered this behavior with our repos, but I compiled the output above from different random repos and files for demonstration

**Comment by kpapadimakis** [comment]
We tried with gost binaries built from tags v3.0.0-rc10 as well as v3.0.0-nightly.20241002

**Comment by kpapadimakis** [comment]
And a tcpdump output for the same example:

```
17:13:24.040685 IP gargleblaster.35892 > mirror.ath1.fusioned.net.http: Flags [P.], seq 740:912, ack 1467, win 249, options [nop,nop,TS val 148426309 ecr 288382463], length 172: HTTP: GET /gstreamer1-plugin-openh264-1.18.2-1.el9.x86_64.rpm HTTP/1.1
E....v@.@.O.
*.......4.P............#......
...E.0].GET /gstreamer1-plugin-openh264-1.18.2-1.el9.x86_64.rpm HTTP/1.1
Host: ciscobinary.openh264.org
User-Agent: libdnf (AlmaLinux 9.4; generic; Linux.x86_64)
Accept: */*


17:13:24.054881 IP mirror.ath1.fusioned.net.http > gargleblaster.35892: Flags [P.], seq 1467:1791, ack 912, win 269, options [nop,nop,TS val 288382523 ecr 148426309], length 324: HTTP: HTTP/1.1 404 Not Found
E..x.V@.;..Z....
*...P.4.............v.....
.0^;...EHTTP/1.1 404 Not Found
Server: nginx/1.14.1
Date: Fri, 04 Oct 2024 14:13:23 GMT
Content-Type: text/html
Content-Length: 169
Connection: keep-alive
```

**Comment by sivann** [comment]
Another tcpdump showing the exact issue:
(actual url renamed to example)

`08:49:20.299445 IP localhost.localdomain.41860 > mirror.ath1.fusioned.net.http: Flags [P.], seq 935:1160, ack 1717, win 249, options [nop,nop,TS val 220902707 ecr 3066861647], length 225: HTTP: GET http://repos.example.com/inaccess/insolar/rhel/9/libiec61850-1.0.0-1.x86_64.rpm HTTP/1.1`

The request in the URL is for **http://repos.example.com** but gost tries to request this url from **mirror.ath1.fusioned.net**, a site involved in a **previous request**.

The issue seems to be hidden fixed when requesting HTTPS (not HTTP) urls.

**Comment by sivann** [comment]
There is a duplicate here which explains how to reproduce:
https://github.com/go-gost/gost/issues/592

**Comment by ginuerzh** [comment]
The HTTP Keep-alive has been disabled by default, you can also manually enable it with the `keepalive` option.

**Comment by kpapadimakis** [comment]
@ginuerzh could you please give a configuration example? Not sure how to use the keepalive option

**Comment by kpapadimakis** [comment]
Yep, this seems to work correctly now. Thanks a lot!
