### ISSUE TITLE
转发后报文缺少部分字节不完整

### ISSUE THREAD

**Issue by mmmiii33** [go-gost/gost#209]
服务端配置：
./gost -L relay+wss://:2233

客户端配置：
./gost -L udp://:14435/127.0.0.1:14435?keepAlive=true -F relay+wss://SERVER_IP:2233

1、服务端发给客户端的报文，客户端收到的不完整
服务端发送长度32828字节的报文：
01:52:59.559109 IP 127.0.0.1.14435 > 127.0.0.1.36055: UDP, length 32828
01:52:59.559154 IP 127.0.0.1.14435 > 127.0.0.1.36055: UDP, length 32828
01:52:59.673355 IP 127.0.0.1.14435 > 127.0.0.1.36055: UDP, length 32828
01:52:59.929406 IP 127.0.0.1.14435 > 127.0.0.1.36055: UDP, length 32828
01:53:00.449387 IP 127.0.0.1.14435 > 127.0.0.1.36055: UDP, length 32828
01:53:01.473368 IP 127.0.0.1.14435 > 127.0.0.1.36055: UDP, length 32828
01:53:03.521507 IP 127.0.0.1.14435 > 127.0.0.1.36055: UDP, length 32828

客户端收到的报文长度只有32768：
01:52:59.647386 IP 127.0.0.1.14435 > 127.0.0.1.41153: UDP, length 32768
01:52:59.697853 IP 127.0.0.1.14435 > 127.0.0.1.41153: UDP, length 32768
01:52:59.747408 IP 127.0.0.1.14435 > 127.0.0.1.41153: UDP, length 32768
01:52:59.966987 IP 127.0.0.1.14435 > 127.0.0.1.41153: UDP, length 32768
01:53:00.537220 IP 127.0.0.1.14435 > 127.0.0.1.41153: UDP, length 32768
01:53:01.561499 IP 127.0.0.1.14435 > 127.0.0.1.41153: UDP, length 32768
01:53:03.609612 IP 127.0.0.1.14435 > 127.0.0.1.41153: UDP, length 32768

2、客户端发给服务端的报文，服务端收到的不完整
客户端发送长度30000字节的报文：
01:54:55.326277 IP 127.0.0.1.33817 > 127.0.0.1.14435: UDP, length 30000
01:54:56.075004 IP 127.0.0.1.40774 > 127.0.0.1.14435: UDP, length 30000
01:54:56.695281 IP 127.0.0.1.33238 > 127.0.0.1.14435: UDP, length 30000
01:54:57.362216 IP 127.0.0.1.35999 > 127.0.0.1.14435: UDP, length 30000
01:54:58.066899 IP 127.0.0.1.36661 > 127.0.0.1.14435: UDP, length 30000
01:54:58.765753 IP 127.0.0.1.56678 > 127.0.0.1.14435: UDP, length 30000

服务端收到的报文长度只有4096：
01:54:55.506869 IP 127.0.0.1.42370 > 127.0.0.1.14435: UDP, length 4096
01:54:56.259389 IP 127.0.0.1.47806 > 127.0.0.1.14435: UDP, length 4096
01:54:56.871673 IP 127.0.0.1.43313 > 127.0.0.1.14435: UDP, length 4096
01:54:57.538586 IP 127.0.0.1.50891 > 127.0.0.1.14435: UDP, length 4096
01:54:58.238418 IP 127.0.0.1.51244 > 127.0.0.1.14435: UDP, length 4096
01:54:58.938065 IP 127.0.0.1.47192 > 127.0.0.1.14435: UDP, length 4096

**Comment by ginuerzh** [comment]
用的是哪个版本?

目前UDP的读缓冲区大小默认是4096字节，可以通过`readBufferSize`选项调整。
```
gost -L relay+wss://:2233?readBufferSize=65535
```
```
gost -L "udp://:14435/127.0.0.1:14435?keepAlive=true&udpBufferSize=65535" -F relay+wss://SERVER_IP:2233
```

**Comment by mmmiii33** [comment]
@ginuerzh 使用的版本是gost 3.0.0-rc7 (go1.20.2 linux/amd64)
按照上面的配置添加了BufferSize后，客户端向服务端发送30000字节的报文正常，服务端能正常收到，问题解决。

但服务端向客户端发送的报文依然存在问题，客户端收到的报文不完整。
服务端向客户端发送的报文，32828字节。
23:14:38.143432 IP 127.0.0.1.14435 > 127.0.0.1.43830: UDP, length 32828
23:14:38.143544 IP 127.0.0.1.14435 > 127.0.0.1.43830: UDP, length 32828
23:14:38.265369 IP 127.0.0.1.14435 > 127.0.0.1.43830: UDP, length 32828
23:14:38.529403 IP 127.0.0.1.14435 > 127.0.0.1.43830: UDP, length 32828
23:14:39.073413 IP 127.0.0.1.14435 > 127.0.0.1.43830: UDP, length 32828
23:14:39.290919 IP 127.0.0.1.43830 > 127.0.0.1.14435: UDP, length 60
23:14:39.333343 IP 127.0.0.1.14435 > 127.0.0.1.43830: UDP, length 60
23:14:40.129446 IP 127.0.0.1.14435 > 127.0.0.1.43830: UDP, length 32828
23:14:42.241534 IP 127.0.0.1.14435 > 127.0.0.1.43830: UDP, length 32828
23:14:46.593712 IP 127.0.0.1.14435 > 127.0.0.1.43830: UDP, length 32828
23:14:50.009170 IP 127.0.0.1.43758 > 127.0.0.1.14435: UDP, length 24

客户端收到服务端的报文，32768字节，少了60字节。
23:14:38.227226 IP 127.0.0.1.14435 > 127.0.0.1.40862: UDP, length 32768
23:14:38.280565 IP 127.0.0.1.14435 > 127.0.0.1.40862: UDP, length 32768
23:14:38.333405 IP 127.0.0.1.14435 > 127.0.0.1.40862: UDP, length 32768
23:14:38.559531 IP 127.0.0.1.14435 > 127.0.0.1.40862: UDP, length 32768
23:14:39.157284 IP 127.0.0.1.14435 > 127.0.0.1.40862: UDP, length 32768
23:14:39.265679 IP 127.0.0.1.40862 > 127.0.0.1.14435: UDP, length 60
23:14:39.362858 IP 127.0.0.1.14435 > 127.0.0.1.40862: UDP, length 60
23:14:40.217194 IP 127.0.0.1.14435 > 127.0.0.1.40862: UDP, length 32768
23:14:42.329040 IP 127.0.0.1.14435 > 127.0.0.1.40862: UDP, length 32768
23:14:46.693647 IP 127.0.0.1.14435 > 127.0.0.1.40862: UDP, length 32768
23:14:49.819289 IP 127.0.0.1.40862 > 127.0.0.1.14435: UDP, length 24

**Comment by ginuerzh** [comment]
这是内部数据缓冲区限制在32768导致的，后面会增大缓冲区。

**Comment by openwrt2223** [comment]
> 这是内部数据缓冲区限制在32768导致的，后面会增大缓冲区。

什么时候修复？

**Comment by ginuerzh** [comment]
最新的提交已经修复。
